title_dt,body_dt
기업공시[7월 25일],&lt;코스닥&gt;
장 중 기업공시[7월25일],&lt;코스닥&gt;
"HDC현대산업개발, 2834억원 규모 채무 보증 결정","이번 채무보증금액은 자기 자본 대비 15.4%이며, 채무보증 총 잔액은 3조 8348억원으로 증가했다."
"이동걸 ""이번주내 아시아나 매각공고""...25일 전망","이 회장은 이날 서울 강남구 코엑스에서 개막한 스타트업 글로벌페어인 '넥스트라이즈(NextRise)2019 서울(Seoul)'에 참석해 이같이 밝혔다. 아직까지 애경그룹 외에 아시아나항공 매각 의사를 구체적으로 밝힌 곳은 없지만 SK, 한화, GS, 롯데, 호반건설 등이 거론되고 있는 가운데 2~3곳이 인수 의사를 타진한 것으로 알려졌다."
"이동걸 ""이번주내 아시아나 매각공고""...25일 전망","다만 금융당국은 아시아나항공 매각과 관련해 말을 아끼는 모습이다. 이날 행사에 참석한 최종구 금융위원장은 기자들과 만나 ""아시아나 항공 매각 문제는 (금융당국이) 더이상 답변 드릴게 없다""면서 ""좋은 원매자가 나타나길 바랄뿐""이라고 했다."
"이동걸 ""이번주내 아시아나 매각공고""...25일 전망","한편 이날 행사에 국내 150개, 해외 50개 등 총 200여개 스타트업들과 국내 대표기업 19개사, 글로벌기업 8개사, 20개 국내외 벤처캐피탈사(VC)가 참가했다."
"이동걸 ""이번주내 아시아나 매각공고""...25일 전망","최 위원장은 환영사에서 ""우리 창업 생태계에서도 스타트업과 기존 기업의 만남, 그리고 협업을 통한 개방형 혁신을 촉진해 나갈 수 있는 방안에 대한 고민의 결과가 오늘 출범하는 넥스트라이즈 2019""라며 ""금융위는 우리경제의 혁신성장을 위해 창업생태계 활성화와 기업의 개방형 혁신문화 확산을 지원해 나갈 것""이라고 했다."
"국내 최대 스타트업 페어 '넥스트라이즈 서울' 개막…""한국판 CES·MWC 만들겠다""","이동걸 산업은행 회장이 올해 처음 열린 혁신성장 페어 '넥스트라이즈 2019 서울'을 미국의 CES(국제소비자가전박람회), 스페인의 MWC(모바일월드콩그레스) 같은 국제적인 혁신성장 축제의 장으로 발전시키겠다고 밝혔다."
"국내 최대 스타트업 페어 '넥스트라이즈 서울' 개막…""한국판 CES·MWC 만들겠다""","산업은행과 한국무역협회는 23일 서울 삼성동 코엑스에서 '넥스트라이즈 2019 서울'의 개회식을 열었다. 넥스트라이즈는 산업은행과 한국무역협회가 벤처기업협회, 벤처캐피탈협회, 국가과학기술연구회와 함께 23~24일 양일간 코엑스에서 개최하는 스타트업 페어다. 국내 벤처·스타트업 업계와 대기업, 투자자들이 대거 참석하고, 해외에서도 벤처캐피탈과 글로벌 정보기술(IT) 기업 관계자들이 현장을 직접 찾는다. 규모로만 보면 스타트업 관련 행사로는 국내 최대라는 게 산업은행의 설명이다."
"국내 최대 스타트업 페어 '넥스트라이즈 서울' 개막…""한국판 CES·MWC 만들겠다""","이틀 동안 열리는 이번 행사에는 실리콘밸리에서 1억달러 이상의 투자를 유치한 김동신 센드버드 대표, 한킴 알토스벤처스 대표, 남태희 스톰벤처스 대표, 권도균 프라이머 대표 등이 마이크를 잡고 자신의 경험과 한국 스타트업 업계의 발전 방향에 대한 의견을 들려줄 예정이다."
"국내 최대 스타트업 페어 '넥스트라이즈 서울' 개막…""한국판 CES·MWC 만들겠다""","해외 연사로는 유명 벤처캐피탈인 500 스타트업스의 크리스틴 차이 대표, 인도네시아 전자상거래 스타트업인 부칼라팍(Bukalapak)의 파즈린 라시드 대표 등이 참석한다."
"국내 최대 스타트업 페어 '넥스트라이즈 서울' 개막…""한국판 CES·MWC 만들겠다""","행사 기간 스타트업과 대기업, 투자자들의 일대일 미팅도 계속 진행된다. 삼성, 현대차, SK텔레콤, LG, 롯데 등 국내 대표 대기업들이 대거 참석해 스타트업과의 협력 기회를 모색하고, 글로벌 IT 기업인 아마존과 레노보, 바스프, 알리바바그룹도 참가한다. 사전에 신청된 일대일 미팅만 약 900건에 달한다고 산업은행은 전했다."
"국내 최대 스타트업 페어 '넥스트라이즈 서울' 개막…""한국판 CES·MWC 만들겠다""","이외에도 대기업별로 자신들이 추진하는 혁신성장 전략을 소개하고, 스타트업의 성장을 도울 수 있는 전략을 알려주는 전문가 세션 등도 준비돼 있다. 산업은행도 4년 동안 운영하고 있는 벤처투자 플랫폼 'KDB 넥스트라운드' 관련 프로그램을 진행할 예정이다."
"국내 최대 스타트업 페어 '넥스트라이즈 서울' 개막…""한국판 CES·MWC 만들겠다""","산업은행은 올해 처음 개최하는 넥스트라이즈를 국내 최대를 넘어서 세계적인 수준의 스타트업 행사로 발전시키겠다고 밝혔다. 이동걸 산업은행 회장은 ""4차산업혁명 분야에서 우리도 빨리 새로운 기업을 키우고 다이나믹하게 다시 신산업을 만들어나가야 한다""며 ""여기서 뒤처지면 우리도 도태될 수 있다""고 강조했다. 그는 ""넥스트라이즈가 미국의 CES나 스페인의 MWC처럼 한국의 혁신성장을 상징하는 국제적인 플랫폼으로 성장할 수 있기를 희망한다""고 덧붙였다."
"산은-무역협회, 국내 최대 글로벌 스타트업 페어 '넥스트라이즈 2019' 개최",산업은행과 한국무역협회가 혁신성장 선도 및 제2벤처붐 조성의 일환으로 공동 주최한 이번 행사는 국내 첫 최대 규모의 글로벌 페어행사로 국내 스타트업 뿐 아니라 국내외 글로벌 대기업 및 벤처캐피탈이 대거 참여한 가운데 진행됐다.
"산은-무역협회, 국내 최대 글로벌 스타트업 페어 '넥스트라이즈 2019' 개최","우선 이번 박람회에서는 스타트업과 기존 기업 간 1대1 사업협력 상담의 장이 마련됐다. 상담 기업에는 삼성과 현대차, SKT, LG, 롯데, 포스코, 한화, GS, KT, S-오일, 한국전력 뿐 아니라 네이버, NC소프트, 스마일게이트 등 대기업 및 벤처1세대 성공기업 다수가 참여한다. 또한 아마존과 레노보, BASF, 알리바바 클라우드 등 글로벌기업도 참가한다."
"산은-무역협회, 국내 최대 글로벌 스타트업 페어 '넥스트라이즈 2019' 개최",앞서 산은과 무역협회는 지난 6월까지 국내외 벤처스타트업을 대상으로 현장상담 접수를 받아 약 900여건의 미팅을 사전 확정했다. 또한 200여 개별 전시부스에서 진행될 현장상담까지 포함할 경우 대략 2000여 건 이상의 사업협력·투자유치 상담이 실시될 것으로 전망된다.
"산은-무역협회, 국내 최대 글로벌 스타트업 페어 '넥스트라이즈 2019' 개최","또 국내외 저명인사들이 대거 연사로 참여해 스타트업 생태계 활성화에 대한 경험 및 인사이트를 공유한다. 한국계 기조연사로는 실리콘밸리에서 1억불 이상 투자를 유치한 SendBird의 김동신 대표, 국내 유니콘기업에 가장 많이 투자하고 있는 Altos Ventures의 한킴 대표 등이 참여를 확정했고 외국계에서는 유명 벤처캐피탈인 500 Startups의 Christine Tsai 대표, 인도네시아의 전자상거래 유니콘 기업인 Bukalapak의 Fajrin Rasyid 대표 등이 연사로 나선다."
"산은-무역협회, 국내 최대 글로벌 스타트업 페어 '넥스트라이즈 2019' 개최","이날 행사에서는 기조강연과 현장상담 외에도 세미나, 포럼 등 다양한 프로그램들이 양일 간에 걸쳐 진행될 예정이다. 국가별 세션에서는 각 국가별 스타트업 지원체계와 진출전략을 다룬다. 캐나다, 이스라엘, 스페인, 아일랜드, 두바이, 브라질, 호주 등과 더불어 인도네시아, 태국, 대만, 중국, 말레이시아, 베트남, 인도, 싱가포르 등 전세계 생태계를 총망라하는 프로그램들이 순차적으로 진행된다."
"산은-무역협회, 국내 최대 글로벌 스타트업 페어 '넥스트라이즈 2019' 개최","기업별 세션에서는 삼성 NEXT, 현대차, BMW, Airbus, Beiersdorf, Johnson&amp;Johnson, Alibaba Cloud, Go-jek 등 국내외 대기업 및 유니콘기업들이 자사의 오픈이노베이션 전략 및 스타트업과의 협업 사례를 공유한다. 이외에도 스타트업을 위한 M&amp;A 전략, 스타트업의 팀빌딩 전략, 스타트업을 위한 브랜드 마케팅, 바이오 진단시장의 패러다임 전환, 글로벌 핀테크 규제현황 등 다양한 전문가 세션도 진행된다."
"산은-무역협회, 국내 최대 글로벌 스타트업 페어 '넥스트라이즈 2019' 개최","산은은 이번 '넥스트라이즈' 행사를 통해 국내 벤처·스타트업의 해외진출 및 스케일업 지원 뿐 아니라 동남아 지역 스타트업을 국내 벤처투자 생태계로 연결하고, 해외 투자자들로 하여금 국내 스타트업에 관심을 갖도록 유도하는 장으로 만드는 등 스타트업과 기존 기업 간을 연결하는 명실상부한 국제 플랫폼으로 자리매김하겠다는 구상이다."
"산은-무역협회, 국내 최대 글로벌 스타트업 페어 '넥스트라이즈 2019' 개최","이동걸 산은 회장은 이날 개회사를 통해 “올해 처음 개최하는 '넥스트라이즈'가 미국의 CES, 스페인의 MWC와 같이 한국의 혁신성장을 상징하는 국제적인 플랫폼으로 성장할 수 있기를 희망한다”고 밝혔다."
"산은-무역협회, 국내 최대 글로벌 스타트업 페어 '넥스트라이즈 2019' 개최","ⓒ (주)데일리안 - 무단전재, 변형, 무단배포 금지"
"산은, ""제2의 벤처붐 확산""…'넥스트라이즈 2019 서울' 개막","'넥스트라이즈 2019, 서울'은 산은과 무협이 벤처기업협회, 벤처캐피탈협회, 국가과학기술연구회와 함께 23~24일 개최하는 스타트업 페어다. 국내에서 처음으로 열리는 최대 규모의 글로벌 행사로서 국내·외 벤처·스타트업, 대기업 및 투자자가 대거 참여한다."
"산은, ""제2의 벤처붐 확산""…'넥스트라이즈 2019 서울' 개막",이번 행사에서는 국내·외 글로벌 대기업들과 벤처캐피탈이 참여해 사업협력 및 투자유치 상담이 진행된다.
"산은, ""제2의 벤처붐 확산""…'넥스트라이즈 2019 서울' 개막",스타트업과의 1대1 사업협력 상담에는국내 대표기업들이 대거 참여한다. 삼성·현대차·SK텔레콤·LG·롯데·포스코·한화·GS· KT·S-오일·한국전력과 함께 네이버·NC소프트·스마일게이트 등 대기업 및 벤처 1세대 성공기업 다수가 참여한다. 또 글로벌기업인 아마존·레노버·BASF·알리바바 클라우드와 미국 AR 유니콘인 매직 리프(Magic Leap) 등도 현장상담에 참여한다.
"산은, ""제2의 벤처붐 확산""…'넥스트라이즈 2019 서울' 개막",투자자와의 1대1 투자유치 상담에는 국내 대표 벤처캐피탈(VC)들이 모두 참여하고 일본·싱가포르·호주·브라질 등 여러 국가의 VC들도 1대 1 상담에 참여한다.
"산은, ""제2의 벤처붐 확산""…'넥스트라이즈 2019 서울' 개막","이를 위해 산은과 무협은 지난 6월까지 국내·외 벤처·스타트업을 대상으로 대기업 및 VC들과의 1대1 현장상담 신청을 접수했다. 23~24일 약 900건의 미팅이 사전에 확정, 현재 현장상담이 진행되고 있다. 또 200여개의 벤처·스타트업이 참여하는 전시부스에서 진행될 현장상담까지 포함할 경우 2000여건 이상의 사업협력·투자유치 상담이 실시될 것으로 전망된다."
"산은, ""제2의 벤처붐 확산""…'넥스트라이즈 2019 서울' 개막","국내·외 저명인사들도 연사로 나섰다. 한국계 기조연사로는 실리콘밸리에서 1억 달러 이상 투자를 유치한 센드버드(SendBird)의 김동신 대표, 국내 유니콘기업에 가장 많이 투자하고 있는 알토스 벤처스의 한킴 대표, 실리콘밸리의 가장 영향력 있는 한국계 투자자 스톰 벤처스의 남태희 대표, 국내 대표적인 액셀러레이터인 프라이머 권도균 대표 등이 참여한다."
"산은, ""제2의 벤처붐 확산""…'넥스트라이즈 2019 서울' 개막","외국계 기조연사로는 유명 벤처캐피탈인 500 스타트업스의 크리스틴 채(Christine Tsai) 대표, 인도네시아의 전자상거래 유니콘 기업인 부칼라팍(Bukalapak)의 공동창업자인 파즈린 라시드(Fajrin Rasyid) 대표, 일본의 대형 벤처캐피탈인 SBI인베스트먼트의 카츠야 카와시마 대표 등이 참여한다."
"산은, ""제2의 벤처붐 확산""…'넥스트라이즈 2019 서울' 개막","기조강연 외에도 국가별 세션, 기업별 세션, 세미나, 포럼 등 다양한 프로그램들이 이틀간 진행된다."
"산은, ""제2의 벤처붐 확산""…'넥스트라이즈 2019 서울' 개막","이동걸 산은 회장은 ""올해 처음 개최하는 넥스트라이즈가 미국의 소비자가전전시회(CES), 스페인의 모바일월드콩그레스(MWC)와 같이 한국의 혁신성장을 상징하는 국제적인 플랫폼으로 성장할 수 있기를 희망한다""고 말했다."
"산은, ""제2의 벤처붐 확산""…'넥스트라이즈 2019 서울' 개막","이날 개회식에서 최종구 금융위원장과 민병두 국회 정무위원장은 각각 환영사와 축사를 통해 ""벤처·스타트업과 국내외 대기업, 투자자들이 하나로 연결되는 이번 페어가 국내 혁신창업 생태계의 성장 및 활성화에 크게 기여할 것""이라는 기대감을 전했다. 박영선 중소벤처기업부장관도 행사장을 방문해 벤처·스타트업을 격려하고 행사의 성공적 개최를 축하했다."
"[이슈분석]금융계열사 매각하는 롯데, 지배구조 전망은?","2017년 10월 지주회사 체제를 구축한 롯데지주는 10월 이전까지 금융계열사 지분을 모두 처분해야 한다. 연간 1000억원 이상 순이익을 거두던 알짜회사인 만큼, 대내외 이목을 끌고 있다."
"[이슈분석]금융계열사 매각하는 롯데, 지배구조 전망은?",IB업계는 롯데캐피탈이 다시 매물로 나올 가능성에 대비해 잠재 인수후보들이 지속적으로 롯데그룹에 매각 여부를 타진하고 있다고 분위기를 전했다.
"[이슈분석]금융계열사 매각하는 롯데, 지배구조 전망은?",롯데캐피탈은 롯데가 보유한 금융계열사 중에서도 알짜일 뿐만 아니라 캐피털 업종이라 대주주 적격성 심사를 거치지 않아도 된다.
"[이슈분석]금융계열사 매각하는 롯데, 지배구조 전망은?","앞서 롯데카드와 롯데손해보험의 경우 올해 초부터 공개매각 절차를 거쳤다. MBK파트너스-우리은행 컨소시엄과 JKL파트너스에 각각 롯데카드(79.83%)와 롯데손보(53.49%) 지분을 매각하기로 결정했으며, 현재 마무리 단계다."
"[이슈분석]금융계열사 매각하는 롯데, 지배구조 전망은?","롯데캐피탈은 롯데그룹의 지원 능력을 바탕으로 'AA-(안정적)' 등급의 높은 신용도를 가지고 있다. 이를 통해 안정적인 자금조달을 확보, 가계대출에서도 타 경쟁사 대비 우위를 점하고 있다."
"[이슈분석]금융계열사 매각하는 롯데, 지배구조 전망은?",현재 롯데캐피탈 매각과 관련해 롯데그룹 내 인수 가능성도 배제할 수 없다. 롯데그룹 내 가장 유력한 인수 기업으로 일본 롯데홀딩스가 있다. 호텔롯데 또한 연내 상장하지 않는다는 점에서 롯데캐피탈 지분 인수 후 한국 롯데와 시너지 효과를 기대할 수 있다.
"[이슈분석]금융계열사 매각하는 롯데, 지배구조 전망은?",금융권 관계자는 “롯데캐피탈의 지분 처분 기한이 3개월 앞으로 다가오면서 롯데그룹 내에서도 여러 가지 시나리오를 검토 중인 것으로 안다”며 “다만 금융계열사와 달리 롯데캐피탈의 경우 일본 롯데홀딩스 및 호텔롯데 등을 통한 매각이 가능해 그룹 내 인수 가능성을 배제할 수 없다”고 말했다.
"[이슈분석]금융계열사 매각하는 롯데, 지배구조 전망은?",이 같은 움직인은 신동빈 롯데 회장의 지배구조를 공고히 하고 과거 경영권 분쟁에 따른 여론을 이번 금융사 매각으로 조기 매듭짓겠다는 의지가 반영됐다.
"[이슈분석]금융계열사 매각하는 롯데, 지배구조 전망은?",복잡했던 순환출자 해소와 지배구조 투명화에 속도를 내기 위한 절차다.
"[이슈분석]금융계열사 매각하는 롯데, 지배구조 전망은?",내부 매각 시나리오는 호텔롯데 등이 롯데지주 보유 캐피탈 지분을 사들이는 것이다. 호텔롯데는 캐피탈 지분 39.37%를 보유한 최대주주다. 하지만 향후 호텔롯데 역시 지주사 체제 내부로 편입될 것으로 분석되는 까닭에 내부 매각은 대안이 될 수 없다.
"[이슈분석]금융계열사 매각하는 롯데, 지배구조 전망은?",특히 롯데그룹이 금융계열사 지분 정리 과정에서 거래 종결성을 중요시하는 등 잡음 없는 매각을 택하고 있다는 점도 외부 매각 가능성을 높이고 있는 대목이다.
"롯데쇼핑, 롯데카드 지분 20% 취득한다","롯데지주는 28일 이사회를 열고 롯데카드 지분 13.95%를 롯데쇼핑에 매각하기로 결의했다고 공시했다. 매각대금은 2292억원이다. 동시에 롯데캐피탈과 부산롯데호텔이 각각 보유한 지분 4.59%와 1.02%, 신동빈 롯데그룹 회장과 신영자 전 롯데장학재단 이사장 지분으로 추정되는 0.44%도 롯데쇼핑에서 995억원에 일괄 매입하기로 했다. 거래는 오는 10월 11일까지 마무리할 예정이다. 거래 종료 후 롯데지주 자회사인 롯데쇼핑은 롯데카드 지분 20%를 보유할 전망이다."
"롯데쇼핑, 롯데카드 지분 20% 취득한다",롯데그룹은 2017년 10월 지주회사 체제로 전환했다. 이후 공정거래법상 일반 지주사는 금융 자회사 주식을 보유할 수 없다는 규정을 따르기 위해 롯데카드와 롯데손해보험의 매각을 추진했다. 지난 5월 말에는 롯데지주 소유 롯데카드 지분 79.83%를 사모펀드(PEF) 운용사인 MBK파트너스와 우리은행 컨소시엄에 총 1조3810억원을 받고 파는 계약을 맺었다. 이번 거래는 그 후속 작업으로 지주사 잔여 지분과 다른 계열사 보유 지분을 한꺼번에 롯데쇼핑에 몰아주기 위한 것이다.
"롯데쇼핑, 롯데카드 지분 20% 취득한다",대형마트는 신용카드사와의 사업 연계성이 가장 높은 분야 중 하나다. 카드 사용액에 따른 수수료 적립 등 마케팅을 수단으로 활용할 수 있다. 마트 결제 기록으로 빅데이터 사업도 가능하다. 롯데카드 관계자는 “그룹 내에서 가장 시너지가 큰 롯데쇼핑이 롯데카드 그룹 잔여 지분을 모두 넘겨받아 계속 보유할 것”이라고 설명했다.
"롯데쇼핑, 롯데카드 지분 20% 취득 결정(종합)","취득 금액은 3천287억원으로, 작년 말 자기자본의 2.65%에 해당한다. 취득 방법은 장외취득이다."
"롯데쇼핑, 롯데카드 지분 20% 취득 결정(종합)",앞서 롯데지주는 지주회사의 행위제한 위반 해소를 위해 자회사 롯데카드 주식 1천42만4천39주를 약 2천292억원에 처분하기로 했다고 공시했다. 처분 후 롯데지주의 롯데카드 지분비율은 0%다.
한화그룹도 ESG채권 발행,"26일 투자은행(IB)업계에 따르면 한화에너지의 미국법인인 한화에너지USA홀딩스는 다음달 말 글로벌 투자자를 대상으로 3억달러(약 3500억원) 규모 그린본드를 발행할 계획이다. 만기는 3~5년 수준으로 검토하고 있다. 산업은행과 스탠다드차타드(SC)증권, 씨티글로벌마켓증권, 크레디아그리콜이 발행 주관을 맡고 있다."
한화그룹도 ESG채권 발행,"한화에너지USA홀딩스는 조달 자금을 미국 현지 태양광발전 투자에 사용할 방침이다. 한화에너지는 한화그룹 태양광사업 중 시스템·발전 부문을 맡고 있다. 한화케미칼(폴리실리콘), 한화큐셀(셀·모듈), 한화종합화학(시스템)을 아우르는 태양광 밸류체인의 핵심 계열사 중 하나다."
한화그룹도 ESG채권 발행,한화그룹은 이번 그린본드 발행으로 국내 10대 그룹 중 다섯 번째로 ‘환경·사회·지배구조(ESG)’ 금융시장에 진입할 전망이다. 2016년 현대캐피탈(그린본드 5억달러)을 시작으로 열린 민간기업의 ESG 금융시장은 한동안 정체 상태에 머물다가 지난해부터 참여 기업이 눈에 띄게 늘었다. 국내 기업의 올 1~5월 ESG 채권 발행금액은 약 5조6200억원으로 지난해 전체 발행금액(4조9000억원)을 넘어섰다.
한화그룹도 ESG채권 발행,과거엔 공기업과 은행 위주였던 발행기업도 갈수록 다양해지고 있다. 환경과 사회공헌의 중요성이 커지는 가운데 정부가 강력하게 친환경정책을 추진하면서 발행 열기가 민간 영역으로도 빠르게 확산하고 있다는 분석이다. 지난해 롯데물산(지속가능채권 2억달러)과 LG디스플레이(그린본드 3억달러)에 이어 올 4월엔 LG화학이 민간기업 사상 최대인 15억6000만달러(그린본드) 규모로 ESG 채권을 발행했다. 포스코도 다음달 중반을 목표로 5억달러어치 발행을 준비하고 있다.
한화그룹도 ESG채권 발행,IB업계 관계자는 “정부가 친환경 정책을 펴는 동시에 이달 직접 ESG 채권을 발행하는 등 큰 관심을 나타낸 결과”라며 “그동안 시장 상황을 지켜보던 여러 기업이 이제는 본격적으로 ESG 채권 발행을 검토할 가능성이 높다”고 말했다.
“스타트업 성공의 산실”…롯데액셀러레이터 데모데이 개최,"데모데이는 롯데액셀러레이터가 초기 스타트업을 선발해 종합 지원하는 엘캠프(L-Camp) 프로그램의 마지막 단계로, 이번이 5회째다."
“스타트업 성공의 산실”…롯데액셀러레이터 데모데이 개최,"이날 행사에는 엘캠프 5기 및 롯데그룹 사내벤처 등 총 24개사가 참여해 전시부스에서 상품 및 서비스 등을 선보였다. 이중 ‘코너마켓’(유아동 중고의류 리세일 서비스), ‘라이트 브라더스’(프리미엄 자전거 중고거래 플랫폼), ‘스티팝’(글로벌 이모티콘 플랫폼) 등 11개사는 사업을 소개하는 프레젠테이션도 진행했다."
“스타트업 성공의 산실”…롯데액셀러레이터 데모데이 개최,"이 자리에는 롯데지주 및 주요 계열사의 신사업담당 임직원, 국내외 유수의 투자기관 관계자 400여 명이 참석해 투자여부를 타진해보고, 스타트업들과 협업 방안을 논의했다."
“스타트업 성공의 산실”…롯데액셀러레이터 데모데이 개최,"엘캠프는 롯데액셀러레이터의 대표적인 스타트업 육성 프로그램으로, 초기 벤처회사를 선발해 6개월 단위로 창업지원금, 사무공간, 사업컨설팅 등을 지원한다. 벤처캐피탈 등 여러 투자자에게 직접 사업을 소개함으로써 후속투자의 가능성을 높일 수 있는 데모데이에 참여할 수 있고 롯데 계열사들과의 실질적인 사업연계가 활발하다는 점에서 스타트업들로부터 큰 호응을 얻고 있다."
“스타트업 성공의 산실”…롯데액셀러레이터 데모데이 개최,롯데액셀러레이터는 2016년부터 엘캠프 프로그램을 통해 총 82개사를 지원해왔다. 이 중 엘캠프 1~4기 스타트업 61개사의 기업가치는 약 3.4배 성장했으며 절반 이상은 후속투자 유치에 성공했다. 직접 고용은 342명에서 694명으로 약 2배 증가했다.
“스타트업 성공의 산실”…롯데액셀러레이터 데모데이 개최,"올 상반기에 운영된 엘캠프 5기의 성장도 눈여겨볼 만하다. 마감 할인하는 식음료를 판매, 구매할 수 있는 커머스 플랫폼을 운영하는 ‘라스트오더’, 24시 즉시 배달 온라인 편의점 ‘나우픽’은 엘캠프 지원을 받는 동안 각 20억원, 6억원의 후속투자를 유치한 바 있다."
“스타트업 성공의 산실”…롯데액셀러레이터 데모데이 개최,"롯데액셀러레이터는 7월 초부터 엘캠프 6기를 모집할 예정이다. O2O, 핀테크, 물류·유통 분야뿐 아니라 인공지능, 로봇, 하이테크 분야의 스타트업을 적극 발굴, 육성한다는 계획이다"
